<?xml version="1.0" encoding="UTF-8"?>
<detail id="10" xmlns:xsi="http://www.w3.org/2001/XMLSchema-instance"  xsi:noNamespaceSchemaLocation="new_detail.xsd">
    <name>new detail</name>
    <price>100</price>
    <carId id="8">
        <brand>audi</brand>
        <model>a4</model>
        <year>2024</year>
        <services> </services>
        <details> </details>
    </carId>
    <inStock>1</inStock>
    <deliveryDays>0</deliveryDays>
    <costs> </costs>
</detail>